{
  "$schema": "https://json-schema.org/draft/2020-12/schema",
  "$id": "https://xbskill.local/schemas/role-knowledge-catalog-v1.json",
  "title": "xbskill RoleKnowledgeCatalog v1",
  "type": "object",
  "additionalProperties": false,
  "required": [
    "record_type",
    "schema_version",
    "catalog_id",
    "catalog_version",
    "origin",
    "published_at",
    "governance_complete",
    "units"
  ],
  "properties": {
    "record_type": {"const": "RoleKnowledgeCatalog"},
    "schema_version": {"const": 1},
    "catalog_id": {"type": "string", "pattern": "^[a-z0-9][a-z0-9-]{2,63}$"},
    "catalog_version": {"type": "string", "pattern": "^[0-9]+\\.[0-9]+\\.[0-9]+$"},
    "origin": {"enum": ["builtin", "project"]},
    "source_registry": {
      "type": "object",
      "additionalProperties": false,
      "required": ["file", "sha256"],
      "properties": {
        "file": {"const": "builtin-source-registry.json"},
        "sha256": {"type": "string", "pattern": "^[a-f0-9]{64}$"}
      }
    },
    "release_binding": {
      "type": "object",
      "additionalProperties": false,
      "required": [
        "candidate_catalog_version", "candidate_catalog_digest", "activated_catalog_version",
        "activated_at", "evidence_file", "evidence_sha256", "source_registry_sha256"
      ],
      "properties": {
        "candidate_catalog_version": {"type": "string", "pattern": "^[0-9]+\\.[0-9]+\\.[0-9]+$"},
        "candidate_catalog_digest": {"type": "string", "pattern": "^[a-f0-9]{64}$"},
        "activated_catalog_version": {"type": "string", "pattern": "^[0-9]+\\.[0-9]+\\.[0-9]+$"},
        "activated_at": {"type": "string", "minLength": 10},
        "evidence_file": {"type": "string", "minLength": 5},
        "evidence_sha256": {"type": "string", "pattern": "^[a-f0-9]{64}$"},
        "source_registry_sha256": {"type": ["string", "null"], "pattern": "^[a-f0-9]{64}$"}
      }
    },
    "published_at": {"type": "string", "minLength": 10},
    "governance_complete": {"type": "boolean"},
    "units": {
      "type": "array",
      "items": {"$ref": "#/$defs/unit"}
    }
  },
  "$defs": {
    "stringList": {
      "type": "array",
      "minItems": 1,
      "items": {"type": "string", "minLength": 1},
      "uniqueItems": true
    },
    "claim": {
      "type": "object",
      "additionalProperties": false,
      "required": ["id", "statement", "conditions", "source_refs", "disconfirming_signals"],
      "properties": {
        "id": {"type": "string", "pattern": "^[a-z0-9][a-z0-9-]{2,63}$"},
        "statement": {"type": "string", "minLength": 1},
        "conditions": {"$ref": "#/$defs/stringList"},
        "source_refs": {"$ref": "#/$defs/stringList"},
        "disconfirming_signals": {"$ref": "#/$defs/stringList"}
      }
    },
    "sourcePacket": {
      "type": "object",
      "additionalProperties": false,
      "required": ["binding_version", "scope_kind", "project_scope_id", "packet_file", "packet_sha256", "lock_id", "lock_digest", "authority_decided_at", "authority_decision_sha256", "rule_scope_digest", "claim_ids"],
      "properties": {
        "binding_version": {"type": "integer", "const": 1},
        "scope_kind": {"type": "string", "const": "project_rule"},
        "project_scope_id": {"type": "string", "pattern": "^[a-z0-9][a-z0-9-]{2,63}$"},
        "packet_file": {"type": "string", "pattern": "^knowledge/packets/[a-z0-9][a-z0-9-]{2,63}\\.json$"},
        "packet_sha256": {"type": "string", "pattern": "^[a-f0-9]{64}$"},
        "lock_id": {"type": "string", "pattern": "^[a-z0-9][a-z0-9-]{2,63}$"},
        "lock_digest": {"type": "string", "pattern": "^[a-f0-9]{64}$"},
        "authority_decided_at": {"type": "string", "pattern": "^\\d{4}-\\d{2}-\\d{2}T\\d{2}:\\d{2}:\\d{2}Z$"},
        "authority_decision_sha256": {"type": "string", "pattern": "^[a-f0-9]{64}$"},
        "rule_scope_digest": {"type": "string", "pattern": "^sha256:[a-f0-9]{64}$"},
        "claim_ids": {
          "type": "array",
          "minItems": 1,
          "uniqueItems": true,
          "items": {"type": "string", "pattern": "^[a-z0-9][a-z0-9-]{2,63}$"}
        }
      }
    },
    "evidenceRef": {
      "type": "object",
      "additionalProperties": false,
      "required": ["file", "sha256", "record_ids"],
      "properties": {
        "file": {"type": "string", "pattern": "^(?:evidence/)?[a-z0-9][a-z0-9-]{2,63}\\.json$"},
        "sha256": {"type": "string", "pattern": "^[a-f0-9]{64}$"},
        "record_ids": {"$ref": "#/$defs/stringList"}
      }
    },
    "decisionGraph": {
      "type": "object",
      "additionalProperties": false,
      "required": ["hypotheses", "distinguishing_action", "evidence_output", "required_permission", "outcomes"],
      "properties": {
        "hypotheses": {
          "type": "array",
          "minItems": 2,
          "items": {"type": "string", "minLength": 1},
          "uniqueItems": true
        },
        "distinguishing_action": {"type": "string", "minLength": 1},
        "evidence_output": {"type": "string", "minLength": 1},
        "required_permission": {"enum": ["propose", "decide", "authorize", "execute", "verify", "accept_risk"]},
        "outcomes": {
          "type": "array",
          "minItems": 2,
          "items": {
            "type": "object",
            "additionalProperties": false,
            "required": ["when", "interpretation", "next_action"],
            "properties": {
              "when": {"type": "string", "minLength": 1},
              "interpretation": {"type": "string", "minLength": 1},
              "next_action": {"type": "string", "minLength": 1}
            }
          }
        }
      }
    },
    "unit": {
      "type": "object",
      "additionalProperties": false,
      "required": [
        "record_type",
        "schema_version",
        "id",
        "version",
        "status",
        "origin",
        "name",
        "job_family",
        "roles",
        "task_families",
        "lifecycle_stages",
        "signals",
        "professional_problem",
        "claims",
        "injection",
        "decision_graph",
        "stage_adaptation",
        "source_refs",
        "evidence_model",
        "permission_model",
        "risk_gates",
        "authority_scope",
        "supersedes",
        "refresh_triggers",
        "tests",
        "review"
      ],
      "properties": {
        "record_type": {"const": "RoleKnowledgeUnit"},
        "schema_version": {"const": 1},
        "id": {"type": "string", "pattern": "^[a-z0-9][a-z0-9-]{2,63}$"},
        "version": {"type": "string", "pattern": "^[0-9]+\\.[0-9]+\\.[0-9]+$"},
        "status": {"enum": ["candidate", "active", "stale", "rejected"]},
        "origin": {"enum": ["builtin", "project"]},
        "name": {"type": "string", "minLength": 1},
        "job_family": {"enum": ["data", "product_rd", "function", "finance", "marketing"]},
        "roles": {"$ref": "#/$defs/stringList"},
        "task_families": {"$ref": "#/$defs/stringList"},
        "lifecycle_stages": {"$ref": "#/$defs/stringList"},
        "signals": {
          "type": "object",
          "additionalProperties": false,
          "required": ["include", "exclude"],
          "properties": {
            "include": {"$ref": "#/$defs/stringList"},
            "exclude": {"$ref": "#/$defs/stringList"}
          }
        },
        "professional_problem": {"type": "string", "minLength": 1},
        "claims": {"type": "array", "minItems": 1, "items": {"$ref": "#/$defs/claim"}},
        "injection": {
          "type": "object",
          "additionalProperties": false,
          "required": ["observe", "competing_explanations", "distinguish", "branches", "actions", "artifacts", "validation", "boundaries", "reality_feedback"],
          "properties": {
            "observe": {"$ref": "#/$defs/stringList"},
            "competing_explanations": {"type": "array", "minItems": 2, "items": {"type": "string", "minLength": 1}, "uniqueItems": true},
            "distinguish": {"$ref": "#/$defs/stringList"},
            "branches": {"$ref": "#/$defs/stringList"},
            "actions": {"$ref": "#/$defs/stringList"},
            "artifacts": {"$ref": "#/$defs/stringList"},
            "validation": {"$ref": "#/$defs/stringList"},
            "boundaries": {"$ref": "#/$defs/stringList"},
            "reality_feedback": {"$ref": "#/$defs/stringList"}
          }
        },
        "decision_graph": {
          "type": "array",
          "minItems": 1,
          "items": {"$ref": "#/$defs/decisionGraph"}
        },
        "stage_adaptation": {
          "type": "object",
          "additionalProperties": false,
          "required": ["S0_new", "S1_working", "S2_system"],
          "properties": {
            "S0_new": {"$ref": "#/$defs/stringList"},
            "S1_working": {"$ref": "#/$defs/stringList"},
            "S2_system": {"$ref": "#/$defs/stringList"}
          }
        },
        "source_refs": {"$ref": "#/$defs/stringList"},
        "evidence_model": {
          "type": "object",
          "additionalProperties": false,
          "required": ["confidence", "observation_window", "limitations"],
          "properties": {
            "confidence": {"enum": ["low", "medium", "high"]},
            "observation_window": {"type": "string", "minLength": 1},
            "limitations": {"$ref": "#/$defs/stringList"}
          }
        },
        "permission_model": {
          "type": "object",
          "additionalProperties": false,
          "required": ["propose", "decide", "authorize", "execute", "verify", "accept_risk"],
          "properties": {
            "propose": {"type": "string", "minLength": 1},
            "decide": {"type": "string", "minLength": 1},
            "authorize": {"type": "string", "minLength": 1},
            "execute": {"type": "string", "minLength": 1},
            "verify": {"type": "string", "minLength": 1},
            "accept_risk": {"type": "string", "minLength": 1}
          }
        },
        "risk_gates": {
          "type": "object",
          "additionalProperties": false,
          "required": ["stop", "escalate", "calibrate"],
          "properties": {
            "stop": {"$ref": "#/$defs/stringList"},
            "escalate": {"$ref": "#/$defs/stringList"},
            "calibrate": {"$ref": "#/$defs/stringList"}
          }
        },
        "authority_scope": {"type": "string", "minLength": 1},
        "supersedes": {"type": "array", "items": {"type": "string", "pattern": "^[a-z0-9][a-z0-9-]{2,63}$"}, "uniqueItems": true},
        "refresh_triggers": {"$ref": "#/$defs/stringList"},
        "source_packet": {"$ref": "#/$defs/sourcePacket"},
        "tests": {
          "type": "object",
          "additionalProperties": false,
          "required": ["positive", "negative", "stage_pair", "overturn", "evidence_refs"],
          "properties": {
            "positive": {"$ref": "#/$defs/stringList"},
            "negative": {"$ref": "#/$defs/stringList"},
            "stage_pair": {"$ref": "#/$defs/stringList"},
            "overturn": {"$ref": "#/$defs/stringList"},
            "evidence_refs": {"type": "array", "items": {"$ref": "#/$defs/evidenceRef"}, "uniqueItems": true}
          }
        },
        "review": {
          "type": "object",
          "additionalProperties": false,
          "required": ["status", "answerer_isolated", "reviewer_independent", "scores", "evidence_refs", "reviewed_at", "reviewer_id"],
          "properties": {
            "status": {"enum": ["pending", "passed", "failed"]},
            "answerer_isolated": {"type": "boolean"},
            "reviewer_independent": {"type": "boolean"},
            "evidence_refs": {"type": "array", "items": {"$ref": "#/$defs/evidenceRef"}, "uniqueItems": true},
            "reviewed_at": {"type": ["string", "null"]},
            "reviewer_id": {"type": ["string", "null"]},
            "scores": {
              "type": "object",
              "additionalProperties": false,
              "required": ["G", "C", "A", "P", "S", "E", "R", "V"],
              "properties": {
                "G": {"type": "integer", "minimum": 0, "maximum": 2},
                "C": {"type": "integer", "minimum": 0, "maximum": 2},
                "A": {"type": "integer", "minimum": 0, "maximum": 2},
                "P": {"type": "integer", "minimum": 0, "maximum": 2},
                "S": {"type": "integer", "minimum": 0, "maximum": 2},
                "E": {"type": "integer", "minimum": 0, "maximum": 2},
                "R": {"type": "integer", "minimum": 0, "maximum": 2},
                "V": {"type": "integer", "minimum": 0, "maximum": 2}
              }
            }
          }
        }
      }
    }
  }
}
