{
  "record_type": "RoleKnowledgeCatalog",
  "schema_version": 1,
  "catalog_id": "xb-builtin-role-knowledge",
  "catalog_version": "0.3.0",
  "origin": "builtin",
  "source_registry": {
    "file": "builtin-source-registry.json",
    "sha256": "6d15ec532ad9cc9537377d1f763e21463962109f3d05e3b0060c7d7492baa837"
  },
  "published_at": "2026-08-11T09:34:07Z",
  "governance_complete": false,
  "units": [
    {
      "record_type": "RoleKnowledgeUnit",
      "schema_version": 1,
      "id": "rk-data-analyst-metric-anomaly",
      "version": "1.0.0",
      "status": "candidate",
      "origin": "builtin",
      "name": "指标异常可信诊断",
      "job_family": "data",
      "roles": [
        "数据分析师"
      ],
      "task_families": [
        "指标异常",
        "数据对账",
        "经营分析",
        "差异解释"
      ],
      "lifecycle_stages": [
        "分析与决定",
        "质量核验",
        "采用反馈"
      ],
      "signals": {
        "include": [
          "指标突升",
          "指标突降",
          "跨表对不上",
          "直接写原因",
          "差异",
          "对账"
        ],
        "exclude": [
          "只做已确认文字排版",
          "无需分析的机械抄录"
        ]
      },
      "professional_problem": "避免把口径、链路、结构或随机波动造成的指标差异直接写成经营原因。",
      "claims": [
        {
          "id": "claim-four-ledgers-before-cause",
          "statement": "异常解释应同时保留口径变化、数据链路、业务结构和真实经营四类候选，并先做能区分它们的核验。",
          "conditions": [
            "当前目标是解释指标异常或差异",
            "至少两类候选会导向不同动作"
          ],
          "source_refs": [
            "OFF-01",
            "OFF-D01"
          ],
          "disconfirming_signals": [
            "用户只需要按已确认事实排版",
            "当前材料已由有权者冻结唯一原因且证据完整"
          ]
        },
        {
          "id": "claim-independent-check-before-adoption",
          "statement": "关键主张需要可复现查询及至少一条独立交叉核验，并把是否被决定人采用与分析正确性分账。",
          "conditions": [
            "结论将支持业务或财务决定"
          ],
          "source_refs": [
            "OFF-D01",
            "GH-D01",
            "GH-D04",
            "GH-D06"
          ],
          "disconfirming_signals": [
            "独立查询不能复现",
            "业务事件证伪",
            "定义版本已改变"
          ]
        }
      ],
      "injection": {
        "observe": [
          "定义、版本、生效日、统计对象、粒度、分母、窗口和源到报表各层",
          "join、去重、迟到、基线、季节性、分群贡献、业务事件与决定人"
        ],
        "competing_explanations": [
          "口径或版本变化",
          "采集、转换或连接链路错误",
          "业务结构变化",
          "真实经营变化",
          "基线随机波动"
        ],
        "distinguish": [
          "做版本对照、独立查询、源到结果对账、贡献拆分和业务 owner 事件复核"
        ],
        "branches": [
          "口径变化则标不可比并重述；链路异常则冻结业务解释；只有结构贡献则不越权写因果；业务证据确认后才给限范围结论"
        ],
        "actions": [
          "建立可信差额，按事实、推断、建议分栏，并保留未知和翻转条件"
        ],
        "artifacts": [
          "口径卡",
          "可信差额表",
          "四本解释账",
          "查询与独立核验记录",
          "采用反馈卡"
        ],
        "validation": [
          "查询可复现，关键主张有独立核验，决定人确认是否采用，后续记录结论翻转或返工"
        ],
        "boundaries": [
          "不得把描述关系升级为因果；异常阈值、观察窗、代表性和可接受误差必须由基线、错误成本与有权者校准"
        ],
        "reality_feedback": [
          "记录结论是否改变决定、决定后的结果、返工、翻转和未采用原因"
        ]
      },
      "decision_graph": [
        {
          "hypotheses": [
            "口径或版本变化",
            "采集、转换或连接链路错误"
          ],
          "distinguishing_action": "固定统计对象和时间窗，做定义版本差分，并用独立查询沿源到报表逐层对账。",
          "evidence_output": "带版本、生效日、层级差额和可复现查询的口径—链路判别表。",
          "required_permission": "verify",
          "outcomes": [
            {
              "when": "版本切点与差异切点一致且同源重算可复现",
              "interpretation": "口径或版本变化优先成立",
              "next_action": "标记不可比区间，由业务 owner 决定重述或保留双口径。"
            },
            {
              "when": "同一版本下源层正确而转换或连接层开始出现差额",
              "interpretation": "采集、转换或连接链路错误优先成立",
              "next_action": "冻结经营原因表述，交数据 owner 修复并重新对账。"
            }
          ]
        },
        {
          "hypotheses": [
            "业务结构变化",
            "真实经营变化",
            "基线随机波动"
          ],
          "distinguishing_action": "做分群贡献拆解、历史基线区间检验，并由业务 owner 核对同期事件及其作用范围。",
          "evidence_output": "分群贡献、基线区间、业务事件和反事实缺口并列的三路判别记录。",
          "required_permission": "verify",
          "outcomes": [
            {
              "when": "总体差异由已知分群权重变化解释且组内指标稳定",
              "interpretation": "业务结构变化优先成立",
              "next_action": "报告结构贡献，不越权升级为经营因果。"
            },
            {
              "when": "组内变化超出基线且有范围、时间一致的业务事实复核",
              "interpretation": "真实经营变化获得限范围支持",
              "next_action": "给出带翻转条件的有限结论，由决定人决定是否采用。"
            },
            {
              "when": "变化落在预先固定的基线波动区间且无稳定分群或事件证据",
              "interpretation": "基线随机波动仍不可排除",
              "next_action": "延长观察或增加样本，不写确定经营原因。"
            }
          ]
        }
      ],
      "stage_adaptation": {
        "S0_new": [
          "给一条逐项清单和样例，用户亲自核一条记录并请复核人确认",
          "S0 只降低操作复杂度，不降低本单元的权限、证据、安全和现实验证门。"
        ],
        "S1_working": [
          "用户独立完成四账、分支和一个真实异常闭环"
        ],
        "S2_system": [
          "设计指标变更、共享语义、独立复核及结论翻转率机制"
        ]
      },
      "source_refs": [
        "OFF-01",
        "OFF-D01",
        "GH-D01",
        "GH-D04",
        "GH-D06"
      ],
      "evidence_model": {
        "confidence": "medium",
        "observation_window": "仅对当前任务与已固定来源版本有效；命中刷新触发器立即重核",
        "limitations": [
          "不能替代本地指标定义、数据事实或因果研究"
        ]
      },
      "permission_model": {
        "propose": "AI 可提出候选解释与核验；用户可修订分析问题",
        "decide": "业务 owner 决定口径、原因采用与业务动作",
        "authorize": "数据 owner 授权数据访问；业务负责人授权试验",
        "execute": "用户在既有权限内运行查询；业务执行者实施获批动作",
        "verify": "分析复核者与业务 owner 分别验证数据主张和业务事实",
        "accept_risk": "业务与数据风险 owner 接受剩余错误和使用风险"
      },
      "risk_gates": {
        "stop": [
          "统计对象、口径版本或关键查询冲突未解时停止原因结论",
          "未授权敏感数据访问时停止取数"
        ],
        "escalate": [
          "需要因果结论、预算动作或跨域口径裁决时交有权者"
        ],
        "calibrate": [
          "异常阈值、观察窗、代表性和可接受误差"
        ]
      },
      "authority_scope": "通用数据分析专业实践；本地指标定义、业务事实与决定权以当前有权真源为准",
      "supersedes": [],
      "refresh_triggers": [
        "指标定义或系统版本变化",
        "独立核验不能复现",
        "业务事件反证",
        "现实采用持续无效"
      ],
      "tests": {
        "positive": [
          "三个系统销量对账且要向财务解释差异"
        ],
        "negative": [
          "只把已确认的三句话排成邮件"
        ],
        "stage_pair": [
          "同一异常事实分别用 S0/S2，专业 claims、权限与安全线一致，仅帮助深度变化"
        ],
        "overturn": [
          "独立查询不能复现时停止业务原因结论"
        ],
        "evidence_refs": []
      },
      "review": {
        "status": "pending",
        "answerer_isolated": false,
        "reviewer_independent": false,
        "scores": {
          "G": 0,
          "C": 0,
          "A": 0,
          "P": 0,
          "S": 0,
          "E": 0,
          "R": 0,
          "V": 0
        },
        "evidence_refs": [],
        "reviewed_at": null,
        "reviewer_id": null
      }
    },
    {
      "record_type": "RoleKnowledgeUnit",
      "schema_version": 1,
      "id": "rk-data-engineer-pipeline-recovery",
      "version": "1.0.0",
      "status": "candidate",
      "origin": "builtin",
      "name": "管道正确性、回填与恢复",
      "job_family": "data",
      "roles": [
        "数据工程师"
      ],
      "task_families": [
        "数据管道",
        "数据同步",
        "回填",
        "故障恢复",
        "数据契约"
      ],
      "lifecycle_stages": [
        "采集与摄取",
        "建模与编排",
        "运行与恢复"
      ],
      "signals": {
        "include": [
          "DAG 成功但数据错",
          "freshness 超时",
          "重复",
          "漏数",
          "schema 变更",
          "回填",
          "重试"
        ],
        "exclude": [
          "纯业务口径归属争议",
          "只需要解释现成图表"
        ]
      },
      "professional_problem": "避免把调度成功当数据正确，并在重复、漏数、部分成功或契约漂移下造成二次污染。",
      "claims": [
        {
          "id": "claim-pipeline-success-not-correctness",
          "statement": "编排运行成功只证明已声明任务状态，不证明源、转换和消费者结果正确。",
          "conditions": [
            "存在数据管道或同步任务"
          ],
          "source_refs": [
            "GH-D03",
            "GH-D05",
            "GH-D06"
          ],
          "disconfirming_signals": [
            "任务不涉及任何数据处理链路"
          ]
        },
        {
          "id": "claim-recovery-needs-idempotency-consumer-check",
          "statement": "回填或重试前应确认幂等、部分成功语义、影响范围、回滚与消费者验收。",
          "conditions": [
            "准备重试、回填、迁移或恢复"
          ],
          "source_refs": [
            "OFF-D01",
            "GH-D01",
            "GH-D05"
          ],
          "disconfirming_signals": [
            "幂等重跑产生重复",
            "消费者结果与管道核验冲突"
          ]
        }
      ],
      "injection": {
        "observe": [
          "schema、主键粒度、run/job/dataset、部分成功语义、迟到、重复、重试幂等和依赖血缘",
          "消费者影响、输入输出快照、回滚与恢复能力"
        ],
        "competing_explanations": [
          "源不完整",
          "契约漂移",
          "转换或 join 错误",
          "编排部分成功",
          "非幂等重试",
          "缓存、时区或迟到策略"
        ],
        "distinguish": [
          "隔离样本重放、输入输出快照对比、关键记录追踪、幂等重跑和消费者侧核验"
        ],
        "branches": [
          "部分成功先隔离下游；不可幂等停止自动重试；兼容漂移做版本适配；恢复已证才回填；不可逆则升级发布策略"
        ],
        "actions": [
          "先圈定影响与消费者，再选择重放、补偿、回填、回滚或停机升级"
        ],
        "artifacts": [
          "影响范围表",
          "运行证据包",
          "回填/回滚决定",
          "runbook",
          "消费者验收记录"
        ],
        "validation": [
          "键级样本与聚合双核验、幂等重跑、恢复演练和消费者验收"
        ],
        "boundaries": [
          "不得无备份或无授权改生产；SLO、告警、回填窗口、容量和恢复目标必须本地校准"
        ],
        "reality_feedback": [
          "记录用户影响、复发、恢复时间、变更失败和下游返工趋势"
        ]
      },
      "decision_graph": [
        {
          "hypotheses": [
            "源不完整",
            "契约漂移",
            "转换或 join 错误"
          ],
          "distinguishing_action": "固定一次运行及键级样本，保存源、契约和转换输入输出快照并逐层重放。",
          "evidence_output": "首个差异层、契约版本、键级样本与聚合差额组成的链路证据包。",
          "required_permission": "verify",
          "outcomes": [
            {
              "when": "源快照已缺失且后续层与其一致",
              "interpretation": "源不完整优先成立",
              "next_action": "隔离受影响数据并由源 owner 确认补数或接受缺口。"
            },
            {